2024-00067653;04/08/24 16:30;04/08/24 21:17;Theft;Active/Pending;Easton, Easton Hall at 3917  Denton Service  Ln
2024-00069289;04/11/24 16:22;04/11/24 16:29;Theft;Arrest;Easton, Easton Hall at 3917  Denton Service  Ln
2024-00070043;05/01/23 00:00;04/12/24 19:44;Title IX Incident Non Criminal;CBE;7, Pocomoke, Pocomoke Building, Police, UMDPS, UMPD at 7569  Baltimore  Ave
2024-00070153;04/12/24 22:20;04/12/24 23:16;Vandalism;Active/Pending;Easton, Easton Hall at 3917  Denton Service  Ln
2024-00070162;04/12/24 23:37;04/12/24 23:37;CDS Violation;Arrest;Easton, Easton Hall at 3917  Denton Service  Ln
2024-00071266;04/13/24 23:00;04/14/24 11:55;Vandalism;Active/Pending;Ellicott, Ellicott Hall at 4052  Stadium  Dr
2024-00071649;04/15/24 03:15;04/15/24 03:15;Noise Complaint;CBE;15, Calvert, Calvert Hall at 7551  Calvert Service  Ln
