2024-00159395;09/27/24 01:00;09/27/24 13:40;Theft;Active/Pending;8100 block of  La Plata  Dr
2024-00159461;09/27/24 16:59;09/27/24 16:59;Suspicious Person/Auto;CBE;Dairy, Stamp, Stamp Student Union, Student Union, Union at 3972  Campus  Dr
2024-00162692;09/29/24 23:00;09/30/24 11:49;Theft;Active/Pending;Oakland, Oakland Hall at 3912  Denton Service  Ln
2024-00162726;09/27/24 02:00;09/30/24 13:45;Theft;Active/Pending;Hagerstown Hall at 8075  Hagerstown  Dr
2024-00162730;09/30/24 09:30;09/30/24 14:00;Theft;Active/Pending;Edward St. John Learning and Teaching Center, ESJ at 4131  Campus  Dr
2024-00162738;09/30/24 04:00;09/30/24 14:14;Theft;Active/Pending;Oakland, Oakland Hall at 3912  Denton Service  Ln
2024-00162967;09/30/24 12:00;09/30/24 20:35;Theft;Active/Pending;Edward St. John Learning and Teaching Center, ESJ at 4131  Campus  Dr
2024-00162990;09/26/24 20:00;09/30/24 21:29;Theft;Active/Pending;Clarice Smith Performing Arts Center, CSPAC at 8270  Alumni  Dr
2024-00163000;09/30/24 18:00;09/30/24 21:55;Theft;Active/Pending;251 North, Denton Area Dining Hall at 3951  Denton Service  Ln
