2025-00020883;01/30/25 17:13;01/30/25 17:13;Fire;CBE;8, Annapolis, Annapolis Hall at 7626  Regents  Dr
2025-00021486;01/31/25 00:01;01/31/25 06:58;Damage to State Property;CBE;3800 block of  Campus  Dr
2025-00021530;01/31/25 08:15;01/31/25 09:06;Suspicious Activity;Active/Pending;Cole, Cole Field House, Cole Student Activities Building, Driskell Center at 4090  Union  Dr
2025-00021662;09/09/24 12:00;01/31/25 13:47;Other Incident;CBE;Architecture, Architecture Building at 3835  Campus  Dr
2025-00022189;01/31/25 23:31;02/01/25 01:23;Damage to State Property;CBE;Lot 19, Lot U2, MLG, Mowatt Garage, Mowatt Lane Parking Garage, PG5 at 7591  Mowatt  Ln
2025-00022713;02/01/25 15:15;02/01/25 15:48;Suspicious Activity;Active/Pending;Delta Gamma, Delta Gamma Sorority at 4518  Knox  Rd
