2025-00059660;03/12/25 21:46;03/12/25 21:46;Vehicle Tampering;Juvenile Arrest;3400 block of  Tulane  Dr
2025-00060982;03/13/25 19:00;03/14/25 11:58;Lost Property;Active/Pending;Architecture, Architecture Building at 3835  Campus  Dr
2025-00062485;03/09/25 08:11;03/16/25 00:50;Damage to State Property;CBE;DOTS Impound Lot, Lot 6, PG4, Terrapin Trail Parking Garage, TTG at 4155  Terrapin  Trl
2025-00063012;03/14/25 21:00;03/16/25 12:52;Assist Other Agency / Rape;CBE;4300 block of  Knox  Rd
2025-00063422;03/16/25 21:24;03/16/25 23:10;Dept Property Damage/Loss;CBE;Stanley R. Zupnick Hall at 8184  Paint Branch  Dr
2025-00064495;03/17/25 22:54;03/17/25 22:54;DWI/DUI;Arrest;University  Blvd
2025-00065844;03/19/25 11:38;03/19/25 11:41;Injured/Sick Person;CBE;College Park Shopping Center, CVS at 7300  Baltimore  Ave
