2024-00186373;10/28/24 06:31;10/28/24 06:31;Injured/Sick Person;CBE;Regents  Dr
2024-00189198;10/31/24 07:56;10/31/24 07:56;Injured/Sick Person;CBE;7600 block of  Library  Ln
2024-00189270;10/30/24 21:30;10/31/24 11:59;Theft;CBE;48, Francis Scott Key, Francis Scott Key Hall, FS Key Hall, FSK at 4282  Chapel  Ln
2024-00189300;10/31/24 06:54;10/31/24 15:32;Vandalism;Active/Pending;Oakland, Oakland Hall at 3912  Denton Service  Ln
2024-00189440;10/31/24 22:25;10/31/24 22:25;Injured/Sick Person;CBE;64, Dorchester, Dorchester Hall at 3947  Campus  Dr
2024-00189562;10/31/24 22:45;10/31/24 23:55;Injured/Sick Person;CBE;Baltimore  Ave
