2024-00103693,06/13/24 05:43,06/13/24 05:43,Suspicious Person/Auto,Arrest,"DOTS, Lot B, Lot RR, PG2, RDG, Regents Drive Parking Garage, WAM Lab at 8056  Regents  Dr"
2024-00121713,07/27/24 09:00,07/27/24 12:11,Theft from Auto,Arrest,"8, Annapolis, Annapolis Hall at 7626  Regents  Dr"
2024-00146682,09/10/24 18:45,09/10/24 20:21,Theft,Investigation Pending,8500 block of  Boteler  Ln
2024-00163009,09/30/24 11:45,09/30/24 22:30,Theft,Investigation Pending,"Edward St. John Learning and Teaching Center, ESJ at 4131  Campus  Dr"
2024-00164210,10/01/24 23:45,10/02/24 13:55,Theft,Investigation Pending,"16, Baltimore, Baltimore Hall at 7497  Calvert Service  Ln"
2024-00164359,10/02/24 13:00,10/02/24 17:53,Theft,Investigation Pending,"Comcast Center, Xfinity, Xfinity Center at 8500  Paint Branch  Dr"
2024-00165402,10/03/24 22:00,10/04/24 01:02,Vandalism,Investigation Pending,"Ellicott, Ellicott Hall at 4052  Stadium  Dr"
