2023-00069114,08/04/23 23:33,08/05/23 12:54,Stolen Motor Vehicle,Investigation Pending,Varsity Sports Teamhouse at 4117  Stadium  Dr
2023-00072699,08/05/23 12:00,08/16/23 13:33,Stolen Motor Vehicle,Investigation Pending,"Cole, Cole Field House, Cole Student Activities Building, Driscoll Center at 4090  Union  Dr"
2023-00082239,09/14/23 15:00,09/15/23 09:07,Theft,Investigation Pending,"Prince Frederick, Prince Frederick Hall at 7030  Preinkert  Dr"
2023-00082254,09/14/23 16:00,09/15/23 11:41,Theft,Investigation Pending,"23, Washington, Washington Hall at 4298  Lehigh  Rd"
2023-00083147,01/25/23 00:00,09/18/23 16:52,Rape (Title IX Related),Investigation Pending,"63, Somerset, Somerset Hall at 7567  Preinkert  Dr"
2023-00083203,09/15/23 16:00,09/18/23 22:27,Theft,Unfounded,"Denton, Denton Hall at 3854  Stadium  Dr"
2023-00087613,10/01/23 21:00,10/03/23 17:55,Vandalism,Investigation Pending,University Courtyard #3 at 8300  Boteler  Ln
