2022-00026509,04/14/22 14:00,04/14/22 15:51,Theft,Warrant Issued,"Edward St. John Learning and Teaching Center, ESJ at 4131  Campus  Dr"
2022-00031206,05/01/22 16:25,05/01/22 16:33,Theft,Warrant Issued,"Brendan Iribe Center, Iribe Center at 8125  Paint Branch  Dr"
2022-00032241,05/04/22 15:30,05/04/22 23:51,Theft,Arrest,"Stamp, Stamp Student Union, Student Union, Union at 3972  Campus  Dr"
2022-00033555,05/08/22 01:00,05/09/22 15:32,Theft,Warrant Issued,"64, Dorchester, Dorchester Hall at 3947  Campus  Dr"
2022-00033932,05/10/22 15:20,05/10/22 20:09,Theft,Warrant Issued,"Brendan Iribe Center, Iribe Center at 8125  Paint Branch  Dr"
2022-00035525,05/15/22 15:50,05/16/22 13:23,Theft,Arrest,"Easton, Easton Hall at 3917  Denton Service  Ln"
2022-00036671,05/20/22 15:00,05/20/22 17:12,Theft,Investigation Pending,"Riggs, Riggs Alumni, Riggs Alumni Center at 7801  Alumni  Dr"
2022-00041346,06/05/22 18:21,06/05/22 18:21,Suspicious Person/Auto,Arrest,Frat Row
